{
  "formatVersion": "1.0",
  "topologyId": "session-cache",
  "epoch": 7,
  "keyTransform": {
    "kind": "braceTag"
  },
  "replication": {
    "factor": 2
  },
  "strategy": {
    "kind": "rendezvous",
    "virtualNodesPerWeightUnit": 8,
    "maxVirtualNodesPerNode": 512
  },
  "nodes": [
    {
      "id": "cache-01",
      "weight": 1,
      "address": "10.4.0.1:11211"
    },
    {
      "id": "cache-02",
      "weight": 1,
      "address": "10.4.0.2:11211"
    },
    {
      "id": "cache-03",
      "weight": 1,
      "address": "10.4.0.3:11211"
    },
    {
      "id": "cache-04",
      "weight": 1,
      "address": "10.4.0.4:11211"
    },
    {
      "id": "cache-05",
      "weight": 2,
      "address": "10.4.0.5:11211"
    },
    {
      "id": "cache-06",
      "weight": 2,
      "address": "10.4.0.6:11211"
    },
    {
      "id": "cache-07",
      "weight": 2,
      "address": "10.4.0.7:11211"
    },
    {
      "id": "cache-08",
      "weight": 0,
      "state": "draining",
      "address": "10.4.0.8:11211"
    }
  ]
}
