{
  "formatVersion": "1.0",
  "topologyId": "ring-seeded",
  "epoch": 118,
  "hash": {
    "algorithm": "siphash-2-4",
    "seed": "9e3779b97f4a7c159e3779b97f4a7c15"
  },
  "replication": {
    "factor": 2
  },
  "strategy": {
    "kind": "ring",
    "tokenAssignment": "derived",
    "tokensPerWeightUnit": 1
  },
  "nodes": [
    {
      "id": "n1"
    },
    {
      "id": "n2"
    },
    {
      "id": "n3"
    },
    {
      "id": "n4"
    }
  ]
}
