{
  "formatVersion": "1.0",
  "topologyId": "health-peers",
  "epoch": 3,
  "replication": {
    "factor": 2
  },
  "strategy": {
    "kind": "rendezvous"
  },
  "nodes": [
    {
      "id": "p1"
    },
    {
      "id": "p2"
    },
    {
      "id": "p3"
    },
    {
      "id": "p4"
    },
    {
      "id": "p5"
    }
  ]
}
