{
  "formatVersion": "1.0",
  "topologyId": "directory-tenants",
  "epoch": 11,
  "replication": {
    "factor": 2
  },
  "strategy": {
    "kind": "directory",
    "entries": [
      {
        "match": {
          "kind": "prefix",
          "value": ""
        },
        "nodes": [
          "cluster-default"
        ],
        "note": "catch-all, PLACE-063"
      },
      {
        "match": {
          "kind": "prefix",
          "value": "gov-"
        },
        "nodes": [
          "cluster-gov-1"
        ]
      },
      {
        "match": {
          "kind": "prefix",
          "value": "gov-hi"
        },
        "nodes": [
          "cluster-gov-2"
        ]
      },
      {
        "match": {
          "kind": "exact",
          "value": "gov-high"
        },
        "nodes": [
          "cluster-gov-3"
        ]
      },
      {
        "match": {
          "kind": "exact",
          "value": "acme"
        },
        "nodes": [
          "cluster-eu-1"
        ]
      },
      {
        "match": {
          "kind": "prefix",
          "value": "ff00",
          "encoding": "base16"
        },
        "nodes": [
          "cluster-binary"
        ]
      }
    ]
  },
  "nodes": [
    {
      "id": "cluster-default"
    },
    {
      "id": "cluster-gov-1"
    },
    {
      "id": "cluster-gov-2"
    },
    {
      "id": "cluster-gov-3"
    },
    {
      "id": "cluster-eu-1"
    },
    {
      "id": "cluster-binary"
    }
  ]
}
