{
  "formatVersion": "1.0",
  "topologyId": "ring-weight-zero",
  "epoch": 1,
  "replication": {
    "factor": 2
  },
  "strategy": {
    "kind": "ring",
    "tokenAssignment": "derived",
    "tokensPerWeightUnit": 4
  },
  "nodes": [
    {
      "id": "rz-live-1",
      "weight": 1
    },
    {
      "id": "rz-live-2",
      "weight": 1
    },
    {
      "id": "rz-zero",
      "weight": 0
    }
  ]
}
