{
  "formatVersion": "1.0",
  "topologyId": "balance-rendezvous",
  "epoch": 1,
  "replication": {
    "factor": 1
  },
  "strategy": {
    "kind": "rendezvous",
    "virtualNodesPerWeightUnit": 1,
    "maxVirtualNodesPerNode": 1024
  },
  "nodes": [
    {
      "id": "b0",
      "weight": 1
    },
    {
      "id": "b1",
      "weight": 1
    },
    {
      "id": "b2",
      "weight": 1
    },
    {
      "id": "b3",
      "weight": 1
    },
    {
      "id": "b4",
      "weight": 1
    },
    {
      "id": "b5",
      "weight": 1
    },
    {
      "id": "b6",
      "weight": 1
    },
    {
      "id": "b7",
      "weight": 1
    }
  ]
}
